,Unique_Id,Location,Property_Type,Address,Rent,Price,Base,Number_Of_Bedroom,Number_Of_Bathroom,Description,Link,Run_Time
783,32|9|2025-05-17|23:08:28.786886,Islington,Flat Share,"Cottenham House, London, N19","£1,000 pcm",1000,pcm,1,1,"We have a comfortably furnished double room available for £1000 per month with all bills included. The property has 1 bathroom, 2 toilets and a generously sized kitchen. Situated in a quiet loca... ** Property Reference: 2395579 **",https://www.rightmove.co.uk/properties/158594657#/?channel=RES_LET,2025-05-17 23:08:28.786886
784,32|10|2025-05-17|23:08:28.786886,Islington,Flat,"Sun Street, The City, London, EC2A","£3,553 pcm",3553,pcm,1,1,"This luxury, one bedroom apartment is set within the fantastic One Crown Place development in the heart of the City of London. It comprises an open plan kitchen/ dining and living room, winter garden, ample bedroom, and a smart bedroom. Features include wood flooring, underfloor heating, comfort ...",https://www.rightmove.co.uk/properties/161174570#/?channel=RES_LET,2025-05-17 23:08:28.786886
785,32|11|2025-05-17|23:08:28.786886,Islington,Flat,"Clarendon Court, 43 Golden Lane, London, Greater London, EC1Y","£7,100 pcm",7100,pcm,3,2,- Penthouse (9th floor) - 3 bedroom - 2 bathroom (including 1 ensuite) - Approx 1400 sqft internal - Approx 700 sqft of outside space - 1 terrace + wrapped around balcony - Air Conditioning - Custom branded furniture - 24 Hr Concierge - Games Room,https://www.rightmove.co.uk/properties/160674977#/?channel=RES_LET,2025-05-17 23:08:28.786886
786,32|12|2025-05-17|23:08:28.786886,Islington,Flat,"Mountgrove Road, Highbury, London, N5","£2,100 pcm",2100,pcm,1,,"ZERO DEPOSIT AVAILABLE. LONG LET. This stylish split level flat on the 3rd floor is bright and spacious throughout featuring a modern open plan kitchen and reception room, well sized bedroom and modern shower room.",https://www.rightmove.co.uk/properties/161170340#/?channel=RES_LET,2025-05-17 23:08:28.786886
787,32|13|2025-05-17|23:08:28.786886,Islington,Apartment,"Moor Lane, London, EC2Y","£4,853 pcm",4853,pcm,2,2,"A luxury two bedroom apartment situated in the sought after Heron development. The property comprises two generously double bedrooms each with fitted wardrobes and en-suite to master, two luxury bathrooms, open plan kitchen with natural wood work surfaces and Miele appliances, white Porcelain til...",https://www.rightmove.co.uk/properties/160266878#/?channel=RES_LET,2025-05-17 23:08:28.786886
788,32|14|2025-05-17|23:08:28.786886,Islington,Apartment,"St. Williams Court, Gifford Street, London, N1","£2,200 pcm",2200,pcm,1,1,Please Quote ID: 58155 **Video Tour Available Upon Request** A stylish and contemporary one-bedroom apartment set within the sought-after St. William's Court development in the heart of Islington. This bright and well-presented hom...,https://www.rightmove.co.uk/properties/161166800#/?channel=RES_LET,2025-05-17 23:08:28.786886
789,32|15|2025-05-17|23:08:28.786886,Islington,Flat,"Collier Street, Angel / Kings Cross N1","£3,467 pcm",3467,pcm,3,1,"Black Katz are pleased to offer to the market this spacious three double bedroom property set on the eighth floor of a secure purpose built block moments to Kings Cross tube station. This very well maintained property comprises a very large lounge with wooden floors, separate kitchen, t...",https://www.rightmove.co.uk/properties/156635534#/?channel=RES_LET,2025-05-17 23:08:28.786886
790,32|16|2025-05-17|23:08:28.786886,Islington,Flat,"Bridgewater Square, The Cobalt Building","£2,925 pcm",2925,pcm,2,2,"A modern two bedroom apartment within this well located development on a quiet square in the City of London. Perfect for those wanting to be near the City's financial centre and tech hub, Clerkenwell and Shoreditch.",https://www.rightmove.co.uk/properties/161147336#/?channel=RES_LET,2025-05-17 23:08:28.786886
791,32|17|2025-05-17|23:08:28.786886,Islington,Flat,"3 Bedroom Flat – Jocelin House , Barnsbury Estate, N1","£2,750 pcm",2750,pcm,3,1,"Andrew Lloyd are pleased to offer this beautiful spacious 3 Bedroom Flat located just under a mile away from angel station with its shops and amenities This property consists of three large average double bedrooms, a spacious separate reception room, fully fitted kitchen with modern appliances...",https://www.rightmove.co.uk/properties/161754254#/?channel=RES_LET,2025-05-17 23:08:28.786886
792,32|18|2025-05-17|23:08:28.786886,Islington,Flat,"Junction Road, 
Tufnell Park, N19","£2,000 pcm",2000,pcm,1,1,"Bright, spacious 1-bed with living room, modern kitchen, Conveniently located near Tufnell Park and Archway stations, with local shops and cafes nearby. Double glazing, neutral décor, and secure entry.",https://www.rightmove.co.uk/properties/161143592#/?channel=RES_LET,2025-05-17 23:08:28.786886
793,32|19|2025-05-17|23:08:28.786886,Islington,Apartment,"Queensland Road, London, N7","£2,080 pcm",2080,pcm,1,1,A one double bedroom apartment set on the fourth floor of this secure modern development with concierge and gym in Holloway.,https://www.rightmove.co.uk/properties/159670436#/?channel=RES_LET,2025-05-17 23:08:28.786886
794,32|20|2025-05-17|23:08:28.786886,Islington,Flat,Copenhagen Street London N1,"£2,800 pcm",2800,pcm,2,1,"A bright and modern two bedroom apartment with private outside space located in a central location close to Coals Drop Yard, Kings Cross.",https://www.rightmove.co.uk/properties/161136062#/?channel=RES_LET,2025-05-17 23:08:28.786886
796,32|22|2025-05-17|23:08:28.786886,Islington,Apartment,"Islington On The Green, 12A Islington Green, Islington, London, N1","£3,445 pcm",3445,pcm,1,1,Large one bedroom apartment with superb private terrace in this popular central Islington development,https://www.rightmove.co.uk/properties/161123825#/?channel=RES_LET,2025-05-17 23:08:28.786886
797,32|23|2025-05-17|23:08:28.786886,Islington,Apartment,"Hazelville Road, London, N19","£2,500 pcm",2500,pcm,3,1,"***LANDLORD WILL ACCEPT SHARERS*** A three-bedroom flat, found in a prime N19 location only a few minutes from Archway Underground Station (Northern Line, Zone 2). The area does not fall short of Green Spaces, amenities, shopping centres and great schools. The property is literally a stone&rsquo...",https://www.rightmove.co.uk/properties/132839228#/?channel=RES_LET,2025-05-17 23:08:28.786886
798,32|24|2025-05-17|23:08:28.786886,Islington,Apartment,"Kings Quarter, Kings Cross, N1","£2,800 pcm",2800,pcm,2,1,"Located in the heart of Kings Cross is this stunning two bedroom, fourth floor apartment offered on a 12 month fixed term rental. Available now.",https://www.rightmove.co.uk/properties/160672625#/?channel=RES_LET,2025-05-17 23:08:28.786886
799,32|25|2025-05-17|23:08:28.786886,Islington,Apartment,"Carrara Tower, 1 Bollinder Place, London, EC1V","£5,900 pcm",5900,pcm,2,2,"Experience elevated city living in this luxurious 2-bedroom, 2-bathroom apartment on the 36th floor of Carrara Tower, EC1V.",https://www.rightmove.co.uk/properties/161623880#/?channel=RES_LET,2025-05-17 23:08:28.786886
801,33|2|2025-05-17|23:08:28.786886,Islington,Apartment,"Junction Road, Archway, London, N19","£2,000 pcm",2000,pcm,1,1,"One bedroom FLAT set within PERIOD CONVERSION and just a short walk from ARCHWAY STATION. Benefitting from FITTED KITCHEN opening to spacious lounge, double bedroom and bathroom. Furnished",https://www.rightmove.co.uk/properties/161115713#/?channel=RES_LET,2025-05-17 23:08:28.786886
802,33|3|2025-05-17|23:08:28.786886,Islington,Apartment,"City Road, London, EC1V","£4,500 pcm",4500,pcm,2,2,"A beautifully presented sub-penthouse apartment situated on the 25th floor of the Art Deco inspired Eagle Point development. Spanning over 1,000 sqft this sleek and modern apartment features a bright and spacious open plan living area with a fully integrated kitchen, access to a large private bal...",https://www.rightmove.co.uk/properties/161114366#/?channel=RES_LET,2025-05-17 23:08:28.786886
803,33|4|2025-05-17|23:08:28.786886,Islington,Apartment,"City Road, London, EC1V","£4,500 pcm",4500,pcm,2,2,"25th floor incredible sub-penthouse in Eagle Point spanning circa 1,050 sqft (approx) on City Road is just a minute’s walk from Old Street Tube Station.",https://www.rightmove.co.uk/properties/159045575#/?channel=RES_LET,2025-05-17 23:08:28.786886
804,33|5|2025-05-17|23:08:28.786886,Islington,Apartment,"Carrara Tower, 1, Bollinder Place, LONDON, EC1V","£4,000 pcm",4000,pcm,2,1,"Modern 2-bedroom, 1-bathroom apartment on the 30th floor of Carrara Tower, EC1V, offering panoramic city views, high-spec interiors, and access to luxury amenities.",https://www.rightmove.co.uk/properties/161623160#/?channel=RES_LET,2025-05-17 23:08:28.786886
805,33|6|2025-05-17|23:08:28.786886,Islington,Flat,"Ashley Road, London, N19","£2,550 pcm",2550,pcm,2,1,"We are proud to offer this delightful 2 bedroom, 1 bathroom flat in a great location. Available to move in from 30 April 2025, this property benefits from garden access. Property is offered unfur... ** Property Reference: 2460036 **",https://www.rightmove.co.uk/properties/161112041#/?channel=RES_LET,2025-05-17 23:08:28.786886
806,33|7|2025-05-17|23:08:28.786886,Islington,Flat,"250 City Road, EC1V","£3,683 pcm",3683,pcm,2,1,"Champs are proud to present this two bedroom apartment in Valencia Tower, 250 City Road. This beautiful apartment compromises of an open plan living area with a modern kitchen, luxurious bathroom, full height windows and two well proportioned bedrooms both with built in wardrobe fitted in.",https://www.rightmove.co.uk/properties/161106959#/?channel=RES_LET,2025-05-17 23:08:28.786886
807,33|8|2025-05-17|23:08:28.786886,Islington,Flat,"Rosebery Avenue, Clerkenwell","£5,200 pcm",5200,pcm,3,2,A magnificent three bedroom split level apartment on the top floors of this distinctive late Victorian building located in Clerkenwell. The apartment has high quality fixtures & fittings throughout and contemporary furnishings.,https://www.rightmove.co.uk/properties/160753562#/?channel=RES_LET,2025-05-17 23:08:28.786886
808,33|9|2025-05-17|23:08:28.786886,Islington,Apartment,"City Garden Row, Islington, London, N1 8DW","£3,650 pcm",3650,pcm,2,2,"Nestled in the vibrant and sought-after neighbourhood of Islington, this exceptional ground floor two-bedroom apartment is located in a charming former warehouse, seamlessly blending contemporary living with industrial character. The property boasts a spacious open-plan kitchen and livin...",https://www.rightmove.co.uk/properties/161096120#/?channel=RES_LET,2025-05-17 23:08:28.786886
809,33|10|2025-05-17|23:08:28.786886,Islington,Flat,"Camden Road, Caledonian Road N7","£4,247 pcm",4247,pcm,4,,"Black Katz are pleased to offer this newly refurbished four bedroom, two bathroom apartment finished to a high standard throughout. This High Spec property boasts four double bedrooms, wood floors, two modern fitted bathrooms with power showers and ceramic tiles, fully fitted modern kitchen with ...",https://www.rightmove.co.uk/properties/138996062#/?channel=RES_LET,2025-05-17 23:08:28.786886
810,33|11|2025-05-17|23:08:28.786886,Islington,Flat,"Camden Road, Caledonian Road N7","£4,247 pcm",4247,pcm,4,2,"*Rent includes gas electric amp; water*Black Katz are pleased to offer this newly refurbished four bedroom, two bathroom apartment finished to a high standard throughout. This Hi Spec property boasts four double bedrooms, wood floors, two modern fitted bathrooms with power showers and ceramic ti...",https://www.rightmove.co.uk/properties/160052780#/?channel=RES_LET,2025-05-17 23:08:28.786886
811,33|12|2025-05-17|23:08:28.786886,Islington,Flat,"Old Street, Old Street, London, EC1V","£3,000 pcm",3000,pcm,2,1,LONG LET. This excellently located 2 bedroom flat is situated on the first floor and offers comfortable living with a bright reception room and access to a lovely roof terrace.,https://www.rightmove.co.uk/properties/161094506#/?channel=RES_LET,2025-05-17 23:08:28.786886
812,33|13|2025-05-17|23:08:28.786886,Islington,Flat,"Gambier, Mora Street, London, EC1V","£3,499 pcm",3499,pcm,3,,"This spacious 3 Bedrooms neat large flat on City Road, close to all Amenities, with walking distance to Shoreditch, Hoxton Square as well as High/Upper Street Islington.",https://www.rightmove.co.uk/properties/148345424#/?channel=RES_LET,2025-05-17 23:08:28.786886
813,33|14|2025-05-17|23:08:28.786886,Islington,Flat,"Ritchie Street, Islington, London, N1","£2,145 pcm",2145,pcm,1,1,"LONG LET. Set within a period build, this delightful 1 bed flat offers well-proportioned interiors complemented by ample sunlight and a private balcony. It further benefits from a central location close to the lush Culpeper Park.",https://www.rightmove.co.uk/properties/161089208#/?channel=RES_LET,2025-05-17 23:08:28.786886
814,33|15|2025-05-17|23:08:28.786886,Islington,Maisonette,"Barnsbury Road, 
Angel, N1","£4,300 pcm",4300,pcm,3,2,"Positioned in a quiet pocket of Barnsbury at the North end of Barnsbury Road, the street is peaceful and the property situated next to with views of Thornhill Gardens.",https://www.rightmove.co.uk/properties/160358318#/?channel=RES_LET,2025-05-17 23:08:28.786886
815,33|16|2025-05-17|23:08:28.786886,Islington,Flat,"Killick Street, Kings Cross","£2,383 pcm",2383,pcm,1,1,"The flat offers a bright and modern living space with plenty of natural light as It features large windows and wooden flooring throughout. The kitchen comes with built-in appliances and the bedroom includes essential furnishings. The building is well-maintained and secure, with friendly neighbour...",https://www.rightmove.co.uk/properties/161084510#/?channel=RES_LET,2025-05-17 23:08:28.786886
816,33|17|2025-05-17|23:08:28.786886,Islington,Flat,"Liverpool Road, 
Angel, N1","£3,350 pcm",3350,pcm,2,1,Arranged over the top floor of this imposing period property is a very large two double bedroom apartment with access to a shared garden.,https://www.rightmove.co.uk/properties/87131265#/?channel=RES_LET,2025-05-17 23:08:28.786886
817,33|18|2025-05-17|23:08:28.786886,Islington,Flat,"St. Paul's Road, Islington","£4,250 pcm",4250,pcm,3,4,"Modern, bright and optimal transport links ! Living space estate agents are proud to present this furnished three-bedroom flat situated in the heart of Highbury and Islington. The flat has Three bedrooms all with their own en-suites along with an additional guessed bathroom.",https://www.rightmove.co.uk/properties/161083982#/?channel=RES_LET,2025-05-17 23:08:28.786886
818,33|19|2025-05-17|23:08:28.786886,Islington,Flat,"City Road, EC1V","£2,075 pcm",2075,pcm,1,1,"One bedroom flat in a well maintained period conversion comprising one double bedroom, bright open plan lounge with high ceilings. The apartment has been finished to a high standard with modern neutral decor, wood floors, high spec fittings, modern kitchen and quality furnishings. The flat is ...",https://www.rightmove.co.uk/properties/161083220#/?channel=RES_LET,2025-05-17 23:08:28.786886
819,33|20|2025-05-17|23:08:28.786886,Islington,Flat,"Archway, London, N19","£3,200 pcm",3200,pcm,3,2,"3 Bedroom Duplex Flat to Rent - 6 Month short let Introducing an opportunity to rent a spacious 3-bedroom, 2 bathroom duplex flat spanning over two floors. Tenants will have access to a spacious kitchen and a garden.",https://www.rightmove.co.uk/properties/161336864#/?channel=RES_LET,2025-05-17 23:08:28.786886
820,33|21|2025-05-17|23:08:28.786886,Islington,Apartment,"Georges Road, Islington, London","£3,400 pcm",3400,pcm,3,1,"Stunning newly refurbished three double bedroom property to rent within a short walk of both Caledonian Road and Highbury and Islington stations. The property comprises three double bedrooms, separate kitchen diner, large reception room and balcony, a luxury bathroom and is spread over two floor...",https://www.rightmove.co.uk/properties/161061950#/?channel=RES_LET,2025-05-17 23:08:28.786886
821,33|22|2025-05-17|23:08:28.786886,Islington,Flat,"Holloway Road, Highbury, London","£2,535 pcm",2535,pcm,1,1,"Stunning spacious flat to rent with a large private terrace within this modern development in Holloway, within walking distance to Holloway Road, Highbury& Islington and Drayton Park Stations, benefiting from excellent transport links and high specifications. This beautiful property benefit...",https://www.rightmove.co.uk/properties/161061263#/?channel=RES_LET,2025-05-17 23:08:28.786886
822,33|23|2025-05-17|23:08:28.786886,Islington,Flat,"Bridgewater Square, City, London, EC2Y","£3,034 pcm",3034,pcm,2,2,"LONG LET. Located in a peaceful residential square in the sought-after area of St Luke's, this 2 bedroom, 2 bathroom flat offers stylish open-plan living space close to the City.",https://www.rightmove.co.uk/properties/161061143#/?channel=RES_LET,2025-05-17 23:08:28.786886
823,33|24|2025-05-17|23:08:28.786886,Islington,Apartment,"Fife Terrace, London, N1","£3,200 pcm",3200,pcm,2,1,2Bed 1 Bath | Kings Cross | Available 10th June | Zone 1 Location | Spacious and Bright | Modern Living | Wooden Flooring,https://www.rightmove.co.uk/properties/161059886#/?channel=RES_LET,2025-05-17 23:08:28.786886
824,33|25|2025-05-17|23:08:28.786886,Islington,Apartment,"Dunford Road, London","£1,600 pcm",1600,pcm,,1,"**Zero Deposit Available**
***ZERO DEPOSIT AVAILABLE***Very comfortable living arrangement with incredibly easy access to the city! The modern property comprises of a large living space/ bedroom which is fully furnished, kitchen is fully equipped &ituated just off the Holloway road, less than th...",https://www.rightmove.co.uk/properties/159958838#/?channel=RES_LET,2025-05-17 23:08:28.786886
826,34|2|2025-05-17|23:08:28.786886,Islington,Apartment,"Author Kings Cross, York Way, London, N1","£7,885 pcm",7885,pcm,3,3,Brand New | 24 hours Concierge | State of Art Gym | Work from Home spaces | Coffee & Wine Bar | Extensive Amenities | Pet Friendly | Super fast broadband l Inhouse Maintenance l Inhouse Management I,https://www.rightmove.co.uk/properties/161056403#/?channel=RES_LET,2025-05-17 23:08:28.786886
827,34|3|2025-05-17|23:08:28.786886,Islington,Flat,166-168 Whitecross Street,"£1,712 pcm",1712,pcm,1,1,"A freshly redecorated, fantastically located one bed flat to rent consisting of a double bedroom, en-suite bathroom and a open plan kitchen/spacious living area",https://www.rightmove.co.uk/properties/160134725#/?channel=RES_LET,2025-05-17 23:08:28.786886
828,34|4|2025-05-17|23:08:28.786886,Islington,Flat,"Goddard Place, London, N19","£2,250 pcm",2250,pcm,2,1,RECENTLY REFURBISHED TOP TO BOTTOM AND NEW BATHROOM In a private gated community with secure parking for up to 2 VEHICLES (1 car plus 1 Motorcycle/Scooter) and bicycles... ABOUT 4 to 5 MINS TO... ** Property Reference: 2442572 **,https://www.rightmove.co.uk/properties/160321394#/?channel=RES_LET,2025-05-17 23:08:28.786886
829,34|5|2025-05-17|23:08:28.786886,Islington,Flat,"Bride Street, Islington, London","£1,599 pcm",1599,pcm,1,1,"FANTASTIC VALUE COSY ONE BEDROOM FLAT to rent set APPROXIMATELY SIX MINUTES WALK TO HIGHBURY AND ISLINGTON TUBE ( VICTORIA LINE ) and London Overground, Zone 2. This lovely apartment comprises generous double bedroom, separate living room with open plan kitchenette and separate bathroom. The fla...",https://www.rightmove.co.uk/properties/161418251#/?channel=RES_LET,2025-05-17 23:08:28.786886
830,34|6|2025-05-17|23:08:28.786886,Islington,Flat,"Holloway Road, Holloway, London, N7","£2,535 pcm",2535,pcm,1,1,LONG LET. A chic 1 bed flat boasts a terrific setting near the Emirates Stadium and is surrounded by renowned institutions. The interiors are flooded with natural light and a private terrace looks onto streetside amenities.,https://www.rightmove.co.uk/properties/161043839#/?channel=RES_LET,2025-05-17 23:08:28.786886
832,34|8|2025-05-17|23:08:28.786886,Islington,Flat,"Pentonville Road, Angel n1","£2,080 pcm",2080,pcm,2,,"A lovely two bedroom property (lounge converted) located in a well maintained building just off Pentonville road. The property has a large double bedroom with storage, a modern tiled bathroom with shower, fitted kitchen, a large lounge that can be used as the second bedroom.",https://www.rightmove.co.uk/properties/149315294#/?channel=RES_LET,2025-05-17 23:08:28.786886
833,34|9|2025-05-17|23:08:28.786886,Islington,Flat,"Goswell Road, 
Angel, EC1V","£3,000 pcm",3000,pcm,1,1,"(SHORT LET) A bright and well presented one bedroom apartment, situated on the first floor of a modern development only moments from Angel Underground & Upper Street.",https://www.rightmove.co.uk/properties/159811118#/?channel=RES_LET,2025-05-17 23:08:28.786886
834,34|10|2025-05-17|23:08:28.786886,Islington,Apartment,"Camden Road, London, N7","£4,250 pcm",4250,pcm,4,2,"A spacious and well presented first floor apartment located close to all amenities of Holloway Road. The property comprises a spacious kitchen diner, four well proportioned double bedrooms and two bathrooms. Available 1st May 2025 offered furnished.",https://www.rightmove.co.uk/properties/159795188#/?channel=RES_LET,2025-05-17 23:08:28.786886
835,34|11|2025-05-17|23:08:28.786886,Islington,Apartment,"Camden Road, London, N7","£4,250 pcm",4250,pcm,4,2,"A spacious and well presented apartment located close to all amenities of Holloway Road. The property comprises a spacious kitchen diner, four well proportioned double bedrooms and two bathrooms. Available immediately offered furnished.",https://www.rightmove.co.uk/properties/159795266#/?channel=RES_LET,2025-05-17 23:08:28.786886
836,34|12|2025-05-17|23:08:28.786886,Islington,Apartment,"Hazelville Road, Archway, London, N19","£2,500 pcm",2500,pcm,3,1,"**SHARERS WELCOME** Niche Estates are proud to offer this  Three bedroom apartment (minus living room), arranged on the ground floor of a Substantial Mid Terrace House in ARCHWAY.",https://www.rightmove.co.uk/properties/161031572#/?channel=RES_LET,2025-05-17 23:08:28.786886
838,34|14|2025-05-17|23:08:28.786886,Islington,Flat,"Kings Cross Road, Kings Cross WC1X","£1,733 pcm",1733,pcm,1,1,"Set on the 1st floor of a period building minutes to Kings Cross Tube this fantastic one bed has been recently decorated and has a modern kitchen, wood floors, neutral decor and a tiled bathroom with shower.",https://www.rightmove.co.uk/properties/161026592#/?channel=RES_LET,2025-05-17 23:08:28.786886
839,34|15|2025-05-17|23:08:28.786886,Islington,Apartment,"Albany Mews, LONDON","£1,985 pcm",1985,pcm,1,1,Newly Refurbished one bedroom apartment with terrace and allocated parking space in the highly sought after area of Barnsbury Park,https://www.rightmove.co.uk/properties/159995627#/?channel=RES_LET,2025-05-17 23:08:28.786886
840,34|16|2025-05-17|23:08:28.786886,Islington,Apartment,"Balfe Street, London, N1","£2,600 pcm",2600,pcm,2,1,"This charming property is located on the desirable Balfe Street in the heart of King’s Cross, offering a wonderful blend of space, character, and convenience. Set over two levels, it provides a comfortable and well-appointed home ideal for professionals, sharers, or a small family.",https://www.rightmove.co.uk/properties/161025122#/?channel=RES_LET,2025-05-17 23:08:28.786886
841,34|17|2025-05-17|23:08:28.786886,Islington,Apartment,"Brewhouse Yard, London, EC1V","£2,980 pcm",2980,pcm,1,1,"Discover the best of London, with this one bedroom apartment in Clerkenwell. with views over the city It'll be easy to simply show up and start living in this elegantly furnished apartment with its fully-equipped kitchen, cozy living room, and our dedicated, on-the-ground support.",https://www.rightmove.co.uk/properties/161022620#/?channel=RES_LET,2025-05-17 23:08:28.786886
842,34|18|2025-05-17|23:08:28.786886,Islington,Flat,"Bollinder Place, London","£3,120 pcm",3120,pcm,1,1,"A SPACIOUS ONE BED APARTMENT IN VALENCIA TOWER PART OF THE 250 CITY ROAD DEVELOPMENT. THIS APARTMENT IS ONE OF ONLY A FEW WITH ITS OWN PRIVATE BALCONY Set over 590 square feet and comprising a spacious reception room with floor to ceiling windows with access to the balcony, lu...",https://www.rightmove.co.uk/properties/161022929#/?channel=RES_LET,2025-05-17 23:08:28.786886
843,34|19|2025-05-17|23:08:28.786886,Islington,Flat,"Hepworth Court, 
Anderson Square, N1","£3,750 pcm",3750,pcm,2,1,"SHORT LET - This large two bedroom apartment has been renovated to a high standard and is offered in immaculate order throughout, set on the second floor of this prestigious gated development in the heart of Angel.",https://www.rightmove.co.uk/properties/161015978#/?channel=RES_LET,2025-05-17 23:08:28.786886
844,34|20|2025-05-17|23:08:28.786886,Islington,Flat,"Highbury Stadium Square, Arsenal, London","£2,600 pcm",2600,pcm,2,2,"FANTASTIC SPACIOUS TWO DOUBLE BEDROOM, TWO BATHROOM APARTMENT WITHIN THE MUCH SOUGHT AFTER HIGHBURY STADIUM SQUARE DEVELOPMENT- VIDEO TOUR AVAILABLE OF APARTMENT. This stunning apartment is offered in EXCELLENT CONDITION. The apartment comprises two DOUBLE BEDROOMS which include CARPETE...",https://www.rightmove.co.uk/properties/161015858#/?channel=RES_LET,2025-05-17 23:08:28.786886
845,34|21|2025-05-17|23:08:28.786886,Islington,Apartment,"Upper Street, London, N1","£6,500 pcm",6500,pcm,2,1,An excellent two bedroom lateral apartment with terrace.,https://www.rightmove.co.uk/properties/161014133#/?channel=RES_LET,2025-05-17 23:08:28.786886
846,34|22|2025-05-17|23:08:28.786886,Islington,Flat,"Macclesfield Road, Clerkenwell","£3,650 pcm",3650,pcm,1,1,"A bright one bedroom penthouse apartment in a modern complex offering open plan living, a large double bedroom and wrap around terrace which expands over 1,100sqft. On the top floor of a secure development, the private roof terrace offers panoramic views of London.",https://www.rightmove.co.uk/properties/161007251#/?channel=RES_LET,2025-05-17 23:08:28.786886
